Category,Fear,Interest,Rage,Enjoyment,New
Person,They give me the creeps.,I've wondered about them.,Don't even talk to me about them!,"Oh yes, I consider us good friends.",Who is that?
Place,I wouldn't go there if I were you.,I'm very interested to see what's there.,Grr. Why does that place even exist?,I've always enjoyed being there.,I've never been.
Thing,It seems... scary.,It really has peaked my interest.,Thinking about it just makes me upset.,I really do like it alot!,I'm not entirely sure what that is.
Activity,Why even do it... that just seems.. *shiver*,"You know, I've always thought about that.",Anyone who gets enjoyment from that is not a friend of mine.,I don't see anything wrong with doing that!,Really? You can do that?
Animal,"I don't know what it is, they're just terrifying.",Those things... I wonder what their story is.,What a useless waste of space they are!,"Being around them calms me down, somehow.",Hmm.. Not sure what I think about that.